mysql> select * from student;
ERROR 1046 (3D000): No database selected
mysql> use student;
Database changed
mysql> select * from student;
+-------+------------+--------+------------+-----------+
| regno | name       | gender | dob        | mobileno  |
+-------+------------+--------+------------+-----------+
|  1233 | priya      | F      | 2005-05-29 | 990077665 |
|  1234 | koushik    | M      | 2005-10-12 | 998770098 |
|  5785 | mahesh     | M      | 2004-01-11 | 999889988 |
|  9955 | prabhas    | M      | 1988-12-12 | 990998990 |
+-------+------------+--------+------------+-----------+
4 rows in set (0.00 sec)

mysql> update student
    -> set regno=5678 where name='priya';
Query OK, 1 row affected (0.00 sec)
Rows matched: 1  Changed: 1  Warnings: 0

mysql> select * from student;
+-------+------------+--------+------------+-----------+
| regno | name       | gender | dob        | mobileno  |
+-------+------------+--------+------------+-----------+
|  1234 | koushik    | M      | 2005-10-12 | 998770098 |
|  5678 | priya      | F      | 2005-05-29 | 990077665 |
|  5785 | mahesh     | M      | 2004-01-11 | 999889988 |
|  9955 | prabhas    | M      | 1988-12-12 | 990998990 |
+-------+------------+--------+------------+-----------+
4 rows in set (0.00 sec)

mysql> delete from student where name='koushik';
Query OK, 1 row affected (0.01 sec)

mysql> select * from student;
+-------+------------+--------+------------+-----------+
| regno | name       | gender | dob        | mobileno  |
+-------+------------+--------+------------+-----------+
|  5678 | priya      | F      | 2005-05-29 | 990077665 |
|  5785 | mahesh     | M      | 2004-01-11 | 999889988 |
|  9955 | prabhas    | M      | 1988-12-12 | 990998990 |
+-------+------------+--------+------------+-----------+
3 rows in set (0.00 sec)